{"limit_policy_version":"1.0","minimum_reader_version":"0.2.0","policy_version":"1.0","record_digest":"9d9bbb6ef9c13eda5587de09525eaa6103e696907b799a36b692edae4ebe5477","schema_digest":"a16877ff4755133f03f5bacc6fd88a061b49607945dc99d2efc4277218b895dc","schema_version":"1.0","values":{"alternate_id_hex_chars":24,"archive_compressed_bytes":67108864,"archive_expanded_bytes":134217728,"archive_ratio":20,"backup_bytes":10485760,"backup_days":30,"backup_records":5,"bundle_files":1024,"bundle_member_bytes":16777216,"bundle_total_bytes":67108864,"cachebuster_hex_chars":32,"evidence_bytes":33554432,"evidence_records":128,"evidence_warning_days":30,"identifier_bytes":63,"journal_record_bytes":524288,"journal_records":32,"journal_total_bytes":8388608,"json_depth":32,"json_members":512,"json_record_bytes":262144,"lock_default_seconds":30,"lock_max_seconds":300,"path_bytes":240,"path_component_bytes":63,"path_components":16,"private_recovery_bytes":33554432,"private_recovery_records":16,"private_recovery_warning_hours":24,"property_ci_examples":500,"state_machine_sequences":100,"state_machine_steps":30,"subprocess_channel_bytes":1048576,"subprocess_tail_bytes":16384,"subprocess_timeout_seconds":90,"subprocess_total_seconds":600,"toml_bytes":2097152,"toml_depth":64,"toml_nodes":4096},"writer_version":"0.2.0"}
